<?xml version="1.0" encoding="UTF-8"?>
<patient xmlns:act="http://www.ujf-grenoble.fr/l3miage/actes" xmlns:cab="http://test/cabinet"
         xmlns:xsi="http://www.w3.org/2001/XMLSchema-instance" xmlns="http://www.ujf-grenoble.fr/l3miage/patient"
         xsi:schemaLocation="http://www.ujf-grenoble.fr/l3miage/patient ../xsd/patient.xsd">
    <nom>Pien</nom>
    <prenom>Oscare</prenom>
    <sexe>M</sexe>
    <naissance>1975-03-25</naissance>
    <numeroSS>65</numeroSS>
    <adresse>
        <rue>rue Casimir Brenier</rue>
        <codePostal>38000</codePostal>
        <ville>Grenoble</ville>
    </adresse>
    <visite date="2015-12-11">
        <intervenant>
            <nom>Sticke</nom>
            <prenom>Sophie</prenom>
        </intervenant>
        <acte>
            Saignée.
        </acte>
        <acte>
            Inection intraveineuse directe isolée.
        </acte>
    </visite>
    <visite date="2015-12-12">
        <intervenant>
            <nom>Frechie</nom>
            <prenom>Sarah</prenom>
        </intervenant>
        <acte>
            Prélèvement par ponction veineuse directe.
        </acte>
        <acte>
            Prélèvement aseptique cutané ou de sécrétions muqueuses, prélèvement
            de selles ou d'urine pour examens sytologiques, bactériologiques, mycologiques.
        </acte>
    </visite>
</patient>